{
  "scanId": "SCAN-04",
  "subjectId": "SUBJ-004",
  "scanModality": "XRAY",
  "scanRegion": "HEAD",
  "timestamp": "2026-06-24T20:30:00Z",
  "detectorOutput": {
    "foreignObjectCandidates": [
      {
        "id": "FO-1",
        "location": { "x": 2.1, "y": 1.4, "z": 3.9 },
        "sizeMm": 9,
        "densityClass": "HIGH",
        "shapeDescriptor": "PELLET_SHAPE"
      }
    ],
    "materialClassProbabilities": {
      "metal": 0.88,
      "ceramic": 0.05,
      "polymer": 0.03,
      "biological": 0.04
    },
    "implantShapeLikelihood": 0.91,
    "anomalyDensity": 0.55,
    "signalNoiseRatio": 18.0,
    "scanQualityScore": 0.72
  },
  "context": {
    "scanPurpose": "SECURITY",
    "environmentRiskLevel": "HIGH",
    "operatorId": "OP-1004"
  },
  "metadata": {
    "deviceModel": "XR-9000",
    "deviceCalibrationState": "OK",
    "softwareVersion": "3.2.1"
  }
}
